{
  "$schema": "./compatibility-manifest.schema.json",
  "manifestKind": "product-compatibility",
  "manifestSchemaVersion": 1,
  "product": "ApiaryLens",
  "releaseKind": "product",
  "productVersion": "0.1.0-preview.6",
  "channel": "preview",
  "supportStatus": "supported",
  "sourceCommit": "19ed016eda60ae66e2d01df373f7bad02e0c237c",
  "buildTime": "2026-07-19T04:02:40.605Z",
  "contracts": {
    "api": "1.0",
    "sync": 1,
    "databaseMigration": "0004",
    "deploymentPlan": 1,
    "export": 1,
    "localStore": 1
  },
  "migration": {
    "head": "0004",
    "historyDigest": "abd8964fcdbe47d31ebfd1d6dca87112a8d7223f9002bea540a9b83f37486f21",
    "history": [
      {
        "version": "0001",
        "sha256": "106db0aa95a58821cbf7bb8e8d0ea48f90a126e94b8fbeadea7c7f55f56fe895"
      },
      {
        "version": "0002",
        "sha256": "17db4fd369edb9244b9f91d9aeed145c3d04ad8ba6e95d06247f07a63527d11a"
      },
      {
        "version": "0003",
        "sha256": "53cfe02a92004b9c826ec76a54c817fe8504975fdb2c6657079cb24e550700f5"
      },
      {
        "version": "0004",
        "sha256": "ccfe8876bdf9fac2de25d4aa3f1bcf7c5b971aa1dd4598152c38971771cbda22"
      }
    ]
  },
  "upgrade": {
    "minimumDirectUpgradeSource": "0.1.0-preview.1",
    "requiresBackupBeforeUpdate": true,
    "backupFormat": 1
  },
  "rollback": {
    "allowedWhenMigrationHeadUnchanged": true,
    "irreversibleTransitions": [],
    "restoreRequiresBackupFormat": 1
  },
  "channelPolicy": {
    "default": "stable",
    "previewOptIn": "explicit",
    "releaseCandidateOptIn": "explicit"
  },
  "verbOwnership": [
    {
      "installChannel": "windows-direct",
      "firstInstall": "user-setup",
      "steadyStateApply": "app-self-updater",
      "repair": "app-headless",
      "uninstall": "app-os-entry"
    },
    {
      "installChannel": "windows-scout",
      "firstInstall": "scout-guided",
      "steadyStateApply": "app-self-updater",
      "repair": "scout-or-app-headless",
      "uninstall": "scout-keep-data-or-os-entry"
    },
    {
      "installChannel": "windows-winget",
      "firstInstall": "winget",
      "steadyStateApply": "winget",
      "repair": "app-headless",
      "uninstall": "winget-or-os-entry"
    },
    {
      "installChannel": "windows-chocolatey",
      "firstInstall": "chocolatey",
      "steadyStateApply": "chocolatey",
      "repair": "app-headless",
      "uninstall": "chocolatey"
    },
    {
      "installChannel": "backend-cloudflare",
      "firstInstall": "scout-or-manual",
      "steadyStateApply": "operator",
      "repair": "scout-or-manual",
      "uninstall": "scout-or-manual"
    },
    {
      "installChannel": "backend-compose",
      "firstInstall": "scout-or-manual",
      "steadyStateApply": "operator",
      "repair": "scout-or-manual",
      "uninstall": "scout-or-manual"
    },
    {
      "installChannel": "backend-airgap",
      "firstInstall": "operator-transported-bundle",
      "steadyStateApply": "operator-transported-bundle",
      "repair": "operator-transported-bundle",
      "uninstall": "operator-transported-bundle"
    },
    {
      "installChannel": "scout",
      "firstInstall": "package-manager-or-download",
      "steadyStateApply": "package-manager-or-download",
      "repair": "redownload",
      "uninstall": "package-manager-or-delete"
    }
  ],
  "artifacts": [
    {
      "name": "apiarylens-0.1.0-preview.6-cloudflare-edaa604384b0.tar.gz",
      "kind": "deployment-bundle",
      "target": "cloudflare",
      "url": "https://apiarylens.org/releases/0.1.0-preview.6/artifacts/apiarylens-0.1.0-preview.6-cloudflare-edaa604384b0.tar.gz",
      "sha256": "edaa604384b0084e59866914d4c16b25edec37a78eee5560ed142cbdc08136bf",
      "bytes": 720138
    },
    {
      "name": "apiarylens-0.1.0-preview.6-compose-a7903bbf5684.tar.gz",
      "kind": "deployment-bundle",
      "target": "compose",
      "url": "https://apiarylens.org/releases/0.1.0-preview.6/artifacts/apiarylens-0.1.0-preview.6-compose-a7903bbf5684.tar.gz",
      "sha256": "a7903bbf568431b041c8b5872967cc813349cbc9aa0f895251db1266bf848a8c",
      "bytes": 197567
    },
    {
      "name": "apiarylens-sbom.cdx.json",
      "kind": "sbom",
      "target": "release",
      "url": "https://apiarylens.org/releases/0.1.0-preview.6/apiarylens-sbom.cdx.json",
      "sha256": "6fa4d39b09ecb7af884a4948d250b4a7669328d9cfa33213789bd5aff3358b45",
      "bytes": 111089
    },
    {
      "name": "apiarylens-license-report.md",
      "kind": "license-report",
      "target": "release",
      "url": "https://apiarylens.org/releases/0.1.0-preview.6/apiarylens-license-report.md",
      "sha256": "e956554602a9bcd2ff2d189868a328d388f7018e58a24e578c2e9608ae13dbc0",
      "bytes": 891
    },
    {
      "name": "apiarylens-provenance.intoto.jsonl",
      "kind": "provenance",
      "target": "release",
      "url": "https://apiarylens.org/releases/0.1.0-preview.6/apiarylens-provenance.intoto.jsonl",
      "sha256": "14d9b467cbfdff1c4e4d3cea7ddce9d7b735c27cd9a0a96b9a3a46f30c095c9c",
      "bytes": 981
    }
  ],
  "revokedArtifacts": [],
  "knownIssues": [],
  "documentation": {
    "releaseNotes": "https://apiarylens.org/releases/0.1.0-preview.6/",
    "updateLifecycle": "https://github.com/ApiaryLens/apiarylens/blob/main/docs/architecture/versioning-release-and-update-lifecycle.md"
  }
}
